{
  "schema_version": "1.0",
  "pack_id": "pack-20260807074344701780-f226577d",
  "nodes": [
    {
      "id": "governance-evidence-boundary",
      "type": "governance",
      "title": "证据、版本、安全与权利治理门",
      "status": "verified",
      "evidence_ids": []
    },
    {
      "id": "anti-dogmatism-correction",
      "type": "capability",
      "title": "事实触发反教条纠错",
      "status": "supporting",
      "evidence_ids": [
        "ev-20260807074344778009-3494d9f2",
        "ev-20260807074344778030-78f124b5",
        "ev-20260807074344778043-2b1625d0"
      ]
    },
    {
      "id": "claim-ev-20260807074344778009-3494d9f2",
      "type": "claim",
      "title": "ev-20260807074344778009-3494d9f2",
      "status": "verified",
      "evidence_ids": [
        "ev-20260807074344778009-3494d9f2"
      ]
    },
    {
      "id": "claim-ev-20260807074344778030-78f124b5",
      "type": "claim",
      "title": "ev-20260807074344778030-78f124b5",
      "status": "verified",
      "evidence_ids": [
        "ev-20260807074344778030-78f124b5"
      ]
    },
    {
      "id": "claim-ev-20260807074344778043-2b1625d0",
      "type": "claim",
      "title": "ev-20260807074344778043-2b1625d0",
      "status": "verified",
      "evidence_ids": [
        "ev-20260807074344778043-2b1625d0"
      ]
    },
    {
      "id": "center-work-coordination",
      "type": "capability",
      "title": "中心任务与并行底线协调",
      "status": "supporting",
      "evidence_ids": [
        "ev-20260807074344778067-2c334f4a",
        "ev-20260807074344778076-2b3036a9"
      ]
    },
    {
      "id": "claim-ev-20260807074344778067-2c334f4a",
      "type": "claim",
      "title": "ev-20260807074344778067-2c334f4a",
      "status": "verified",
      "evidence_ids": [
        "ev-20260807074344778067-2c334f4a"
      ]
    },
    {
      "id": "claim-ev-20260807074344778076-2b3036a9",
      "type": "claim",
      "title": "ev-20260807074344778076-2b3036a9",
      "status": "verified",
      "evidence_ids": [
        "ev-20260807074344778076-2b3036a9"
      ]
    },
    {
      "id": "contradiction-reclassification",
      "type": "capability",
      "title": "阶段性主要问题与改判",
      "status": "supporting",
      "evidence_ids": [
        "ev-20260807074344778094-b5dc328e",
        "ev-20260807074344778101-39371ae4"
      ]
    },
    {
      "id": "claim-ev-20260807074344778094-b5dc328e",
      "type": "claim",
      "title": "ev-20260807074344778094-b5dc328e",
      "status": "verified",
      "evidence_ids": [
        "ev-20260807074344778094-b5dc328e"
      ]
    },
    {
      "id": "claim-ev-20260807074344778101-39371ae4",
      "type": "claim",
      "title": "ev-20260807074344778101-39371ae4",
      "status": "verified",
      "evidence_ids": [
        "ev-20260807074344778101-39371ae4"
      ]
    },
    {
      "id": "distribution-before-aggregate",
      "type": "capability",
      "title": "分布检查优先于总体指标",
      "status": "verified",
      "evidence_ids": [
        "ev-20260807074344778122-9f367d4a",
        "ev-20260807074344778130-37784376"
      ]
    },
    {
      "id": "claim-ev-20260807074344778122-9f367d4a",
      "type": "claim",
      "title": "ev-20260807074344778122-9f367d4a",
      "status": "verified",
      "evidence_ids": [
        "ev-20260807074344778122-9f367d4a"
      ]
    },
    {
      "id": "claim-ev-20260807074344778130-37784376",
      "type": "claim",
      "title": "ev-20260807074344778130-37784376",
      "status": "verified",
      "evidence_ids": [
        "ev-20260807074344778130-37784376"
      ]
    },
    {
      "id": "feedback-integrity",
      "type": "capability",
      "title": "一线反馈完整闭环",
      "status": "verified",
      "evidence_ids": [
        "ev-20260807074344778145-fde1eae4",
        "ev-20260807074344778152-1651d763",
        "ev-20260807074344778159-ef36a626",
        "ev-20260807074344778167-4e30fe24",
        "ev-20260807074344778174-9bf8a104"
      ]
    },
    {
      "id": "claim-ev-20260807074344778145-fde1eae4",
      "type": "claim",
      "title": "ev-20260807074344778145-fde1eae4",
      "status": "verified",
      "evidence_ids": [
        "ev-20260807074344778145-fde1eae4"
      ]
    },
    {
      "id": "claim-ev-20260807074344778152-1651d763",
      "type": "claim",
      "title": "ev-20260807074344778152-1651d763",
      "status": "verified",
      "evidence_ids": [
        "ev-20260807074344778152-1651d763"
      ]
    },
    {
      "id": "claim-ev-20260807074344778159-ef36a626",
      "type": "claim",
      "title": "ev-20260807074344778159-ef36a626",
      "status": "verified",
      "evidence_ids": [
        "ev-20260807074344778159-ef36a626"
      ]
    },
    {
      "id": "claim-ev-20260807074344778167-4e30fe24",
      "type": "claim",
      "title": "ev-20260807074344778167-4e30fe24",
      "status": "verified",
      "evidence_ids": [
        "ev-20260807074344778167-4e30fe24"
      ]
    },
    {
      "id": "claim-ev-20260807074344778174-9bf8a104",
      "type": "claim",
      "title": "ev-20260807074344778174-9bf8a104",
      "status": "verified",
      "evidence_ids": [
        "ev-20260807074344778174-9bf8a104"
      ]
    },
    {
      "id": "investigation-before-judgment",
      "type": "capability",
      "title": "调查先于判断",
      "status": "supporting",
      "evidence_ids": [
        "ev-20260807074344778189-a07f6c8d",
        "ev-20260807074344778195-aa17d49c"
      ]
    },
    {
      "id": "claim-ev-20260807074344778189-a07f6c8d",
      "type": "claim",
      "title": "ev-20260807074344778189-a07f6c8d",
      "status": "verified",
      "evidence_ids": [
        "ev-20260807074344778189-a07f6c8d"
      ]
    },
    {
      "id": "claim-ev-20260807074344778195-aa17d49c",
      "type": "claim",
      "title": "ev-20260807074344778195-aa17d49c",
      "status": "verified",
      "evidence_ids": [
        "ev-20260807074344778195-aa17d49c"
      ]
    },
    {
      "id": "practice-test-loop",
      "type": "capability",
      "title": "实践检验与改判",
      "status": "supporting",
      "evidence_ids": [
        "ev-20260807074344778209-9d9f6592",
        "ev-20260807074344778216-0a7f7cef"
      ]
    },
    {
      "id": "claim-ev-20260807074344778209-9d9f6592",
      "type": "claim",
      "title": "ev-20260807074344778209-9d9f6592",
      "status": "verified",
      "evidence_ids": [
        "ev-20260807074344778209-9d9f6592"
      ]
    },
    {
      "id": "claim-ev-20260807074344778216-0a7f7cef",
      "type": "claim",
      "title": "ev-20260807074344778216-0a7f7cef",
      "status": "verified",
      "evidence_ids": [
        "ev-20260807074344778216-0a7f7cef"
      ]
    },
    {
      "id": "protected-dissent-channel",
      "type": "capability",
      "title": "异议与坏消息保护",
      "status": "verified",
      "evidence_ids": [
        "ev-20260807074344778232-95cbaab2",
        "ev-20260807074344778239-072a7e52",
        "ev-20260807074344778246-355277b4"
      ]
    },
    {
      "id": "claim-ev-20260807074344778232-95cbaab2",
      "type": "claim",
      "title": "ev-20260807074344778232-95cbaab2",
      "status": "verified",
      "evidence_ids": [
        "ev-20260807074344778232-95cbaab2"
      ]
    },
    {
      "id": "claim-ev-20260807074344778239-072a7e52",
      "type": "claim",
      "title": "ev-20260807074344778239-072a7e52",
      "status": "verified",
      "evidence_ids": [
        "ev-20260807074344778239-072a7e52"
      ]
    },
    {
      "id": "claim-ev-20260807074344778246-355277b4",
      "type": "claim",
      "title": "ev-20260807074344778246-355277b4",
      "status": "verified",
      "evidence_ids": [
        "ev-20260807074344778246-355277b4"
      ]
    },
    {
      "id": "relational-problem-map",
      "type": "capability",
      "title": "关系化问题地图",
      "status": "supporting",
      "evidence_ids": [
        "ev-20260807074344778262-ea442209",
        "ev-20260807074344778269-469ea6c2"
      ]
    },
    {
      "id": "claim-ev-20260807074344778262-ea442209",
      "type": "claim",
      "title": "ev-20260807074344778262-ea442209",
      "status": "verified",
      "evidence_ids": [
        "ev-20260807074344778262-ea442209"
      ]
    },
    {
      "id": "claim-ev-20260807074344778269-469ea6c2",
      "type": "claim",
      "title": "ev-20260807074344778269-469ea6c2",
      "status": "verified",
      "evidence_ids": [
        "ev-20260807074344778269-469ea6c2"
      ]
    },
    {
      "id": "rights-bound-transfer",
      "type": "capability",
      "title": "历史方法现代迁移治理门",
      "status": "supporting",
      "evidence_ids": [
        "ev-20260807074344778283-896714d3",
        "ev-20260807074344778290-f366b05d",
        "ev-20260807074344778297-358e3c96"
      ]
    },
    {
      "id": "claim-ev-20260807074344778283-896714d3",
      "type": "claim",
      "title": "ev-20260807074344778283-896714d3",
      "status": "verified",
      "evidence_ids": [
        "ev-20260807074344778283-896714d3"
      ]
    },
    {
      "id": "claim-ev-20260807074344778290-f366b05d",
      "type": "claim",
      "title": "ev-20260807074344778290-f366b05d",
      "status": "verified",
      "evidence_ids": [
        "ev-20260807074344778290-f366b05d"
      ]
    },
    {
      "id": "claim-ev-20260807074344778297-358e3c96",
      "type": "claim",
      "title": "ev-20260807074344778297-358e3c96",
      "status": "verified",
      "evidence_ids": [
        "ev-20260807074344778297-358e3c96"
      ]
    },
    {
      "id": "stage-experimentation",
      "type": "capability",
      "title": "阶段识别与窄目标试点",
      "status": "supporting",
      "evidence_ids": [
        "ev-20260807074344778354-518e182b",
        "ev-20260807074344778362-55b202a3"
      ]
    },
    {
      "id": "claim-ev-20260807074344778354-518e182b",
      "type": "claim",
      "title": "ev-20260807074344778354-518e182b",
      "status": "verified",
      "evidence_ids": [
        "ev-20260807074344778354-518e182b"
      ]
    },
    {